{
  "branch": "shiki/t-20260807t035659160500z-ba479979-ship-mergegate-s-blocking-reasons-out-of-the-run",
  "created_at": "2026-08-07T04:59:33+00:00",
  "created_by": "shiki-run",
  "goal_id": "G-20260807T035659158223Z-af599ebb",
  "locks": [
    "path:.github/workflows/shiki-mergegate.yml",
    "path:scripts/shiki_loop.py",
    "path:scripts/shiki_tasks.py",
    "path:tests/test_repair_reasons.py"
  ],
  "path": "/Users/kio.mizutani/shiki/.claude/worktrees/.worktrees/shiki-t-20260807t035659160500z-ba479979-ship-mer",
  "pr": 320,
  "runtime": "claude-code",
  "state": "active",
  "task_id": "T-20260807T035659160500Z-ba479979"
}
