{
  "branch": "shiki/t-20260727t005125902419z-6c2db440-deliver-the-contract-pr-registration-path-and-re",
  "created_at": "2026-07-27T00:51:25+00:00",
  "created_by": "shiki-run",
  "goal_id": "G-20260727T005125900810Z-077718f7",
  "locks": [
    "path:scripts/shiki_tasks.py",
    "path:scripts/shiki_cli.py",
    "path:scripts/mergegate_check.py",
    "path:CONTEXT.md",
    "path:docs/adr/**",
    "path:tests/**",
    "path:scripts/test_shiki_*.sh",
    "path:.shiki/**"
  ],
  "path": "/Users/kio.mizutani/shiki/.claude/worktrees/.worktrees/shiki-t-20260727t005125902419z-6c2db440-deliver-",
  "pr": 179,
  "runtime": "claude-code",
  "state": "registered",
  "task_id": "T-20260727T005125902419Z-6c2db440"
}
