{
  "branch": "shiki/t-20260730t060551622687z-7bea1bc2-cover-the-goal-completion-ledger-and-its-scoreca",
  "created_at": "2026-07-30T06:05:51+00:00",
  "created_by": "shiki-run",
  "goal_id": "G-20260730T060551621252Z-6ab5c407",
  "locks": [
    "path:scripts/mergegate_check.py",
    "path:tests/test_completion_lock_scope.py"
  ],
  "path": "/Users/kio.mizutani/shiki/.claude/worktrees/.worktrees/shiki-t-20260730t060551622687z-7bea1bc2-cover-th",
  "pr": 202,
  "runtime": "claude-code",
  "state": "active",
  "task_id": "T-20260730T060551622687Z-7bea1bc2"
}
